2019,Sacred Heart University,Religious,James Martin,Campus Speech,"Gender, Religion, Sexuality","Activist(s), General Public, Student Group(s), Student(s)",From the Right,No,Yes,Disinvitation Attempt,Not Applicable,"Community members, student groups, students, and activists petitioned —&nbsp;receiving almost 20,000 signatures — and protested Martin’s speaking appearance at an LGBT group's on-campus event, claiming Martin's views on homosexuality and transgenderism went against Catholic doctrine. The university president derided protesters, saying their protests were an attempt at ""bullying"" and “laden with bigotry and self-righteousness.” Martin spoke successfully.","Honor Roll
Neutral. The president posted that he had received “an outpouring of letters, emails and calls regarding Martin’s views . . . laden with bigotry and self-righteousness. . . .[attempts at] bullying” . . . [and contrary to] open debate and discourse. [But he was not going to be swayed]""",[],65c1510779db8200391e9a23
2019,Saint Joseph's University,Religious,James Martin,Campus Speech,"Gender, Religion, Sexuality","Activist(s), General Public, Student Group(s), Student(s)",From the Right,No,Yes,Disinvitation Attempt,Not Applicable,"Students, student groups, activists, and the general public signed a petition to stop Martin from speaking at the university because of Martin's views on sexual orientation. The petition garnered almost 20,000 signatures but the university administration refused to disinvite Martin and he spoke successfully.",None,[],65c1510779db8200391e9a2a
2019,Seton Hall University,Religious,Stanley Fish,Campus Speech,Race,"Activist(s), Faculty, Student(s)",From the Left,No,No,Revoked,No,A faculty committee canceled Fish's speech in the wake of student protests demanding that the university English department focus more on racial issues.,None,[],65c1510779db8200391e9a31
2019,Spelman College,Secular,Keisha Lance Bottoms,Commencement Speech,"Class or Policy Issues, Police, Race",Student(s),From the Left,No,Yes,Disinvitation Attempt,Not Applicable,"Students petitioned the college to rescind its invitation of Bottoms to speak at commencement because of Bottoms' support for policies ""catalyzing the gentrification of West End Atlanta"" and because of how Bottoms responded to the homelessness crisis and the deaths of two black men shot and killed by Atlanta police officers. Bottoms spoke successfully.","Supported Content of Expression. The university president said in announcing the speaker event ""Atlanta is fortunate to have such a dynamic leader as Mayor Keisha Lance Bottoms, who has had a tremendous impact on the city, in particular on the Westside, where Spelman is located.""",[],65c1510779db8200391e9a38
2019,Stanford University,Secular,Joe Lonsdale,Campus Speech,Criminal or Other Misconduct,"Activist(s), General Public, Student Group(s), Student(s)",Not Applicable,No,No,Revoked,No,"A fraternity disinvited Lonsdale from an event on public policy, technology, and entrepreneurship after a university student he had mentored made sexual assault, gender violence, and sexual harassment allegations against him. While there are inconsistencies in how the Title IX investigation results are reported, it seems the findings for some of the worst of the allegations were reversed. However, Lonsdale was sanctioned for not disclosing his relationship with an undergraduate he was mentoring, as required by university policy.",None,[],65c1510779db8200391e9a3f
2019,"State University of New York, Oneonta",Public,Sean Kingston,Performance,Criminal or Other Misconduct,"Administrator(s), Politician(s), Student Group(s), Student(s)",From the Left,No,Yes,Revoked,No,"Students petitioned the university to cancel Kingston's performance and planned to protest if Kingston performed, citing a past sexual assault allegation against Kingston. The city pulled the permit allowing the event to take place in the park because it felt the university lacked an adequate plan for dealing with anticipated protests. Once the permit was revoked, the university claimed 36 hours wasn't enough time to arrange for a different location and the performance was canceled.","Neutral (Disingenuous). The vice president of student development said: ""We regret needing to make this choice and acknowledge it will disappoint members of Oneonta’s campus communities and many others. However, the college, no matter the circumstances, must act in students’ best interests.""",[],65c1510779db8200391e9a46
2019,Taylor University,Religious,Mike Pence,Commencement Speech,Political Views,"Alumni, Faculty, Student(s)",From the Left,Yes,No,Disinvitation Attempt,Not Applicable,"Students, faculty, and alumni petitioned the university to disinvite then-Vice President Pence from delivering a commencement speech, claiming Pence's political views do not align with Christian values. Others petitioned in favor of allowing Pence to speak. A number of students and faculty walked out of the commencement ceremony during Pence's speech, but the speech proceeded without disruption.","Supported Speaker (or Artist) as a Person. The university published a statement that included: “Taylor University is honored to have Vice President Mike Pence featured as our commencement speaker. Mr. Pence has been a good friend to the University over many years, and is a Christian brother whose life and values have exemplified what we strive to instill in our graduates.”",[],65c1510779db8200391e9a4d
2019,"The Savannah College of Art and Design, The University for Creative Careers",Secular,Peter Morino,Commencement Speech,"Criminal or Other Misconduct, Gender, Race, Sexuality",Student(s),From the Left,No,Yes,Disinvitation Attempt,Not Applicable,"Students petitioned the college to rescind its invitation of Morino to speak at commencement because of several sexual assault, harassment, and slander charges against Morino. Morino spoke successfully.",None,[],65c1510779db8200391e9a54
2019,The United States Army War College,Public,Raymond Ibrahim,Campus Speech,"Religion, Terrorism","Activist(s), Administrator(s)",From the Left,Yes,Yes,Revoked,Yes,"The college disinvited Ibrahim after receiving criticism, including letters and a petition started by outside groups, of Ibrahim's views on Islam and Muslim-West relations. The National Association of Scholars organized a counter-petition/open letter to send to then-President Trump to ask him to intervene on Ibrahim's behalf.","Encouraged (or Approved of) Self-Censorship. A college spokesperson issued a statement that included: ""The presentation of Mr. Raymond Ibrahim’s book is postponed so USAHEC can pair Mr. Ibrahim’s military history insights in close proximity with another historical perspective, at a time when the USAWC curriculum has addressed historical analysis of influences on conflict.”",[],65c1510779db8200391e9a5b
2019,Trinity University,Religious,Heather Mac Donald,Campus Speech,"Political Views, race","Administrator(s), Student Group(s), Student(s)",From the Left,No,No,Revoked,No,"The student government unanimously voted against funding Mac Donald's talk on campus, objecting to the amount of funding requested and describing the speaker's viewpoints on university diversity and inclusion offices as controversial. The student government seemed to have been influenced by the university president and dean of students, who attended a meeting and expressed their disapproval of Mac Donald.",None,[],65c1510779db8200391e9a62
2019,"University of California, Berkeley",Public,Ann Coulter,Campus Speech,"Political Views, immigration",Student(s),From the Left,No,No,Attempted Disruption,No,"Students protested Coulter's speech on immigration. Police escorted attendees into the event because protesters began pushing them and chanting, ""Don't let them in."" Six or more protesters were arrested outside the venue and one was arrested inside. Despite some heckling, Coulter finished her talk.","Honor Roll
Neutral. A university spokesperson told reporters: “We have work to continue to find ways we can accommodate profound differences of opinion. We believe we have met our obligations to both free speech and the rule of law, and to provide for the safety and well-being of students and campus guests.""",[],65c1510779db8200391e9a69
2019,"University of California, Los Angeles",Public,Donald Trump Jr.,Campus Speech,Other,Student(s),From the Right,No,No,Substantial Event Disruption,No,"Turning Point USA hosted an event featuring Trump Jr. (and Kimberly Guilfoyle). During the event, supporters of Trump Jr.'s father, former President Trump, heckled Trump Jr. and disrupted the event after learning that Turning Point USA had canceled the Q&amp;A session.",None,[],65c1510779db8200391e9a70
2019,"University of California, Los Angeles",Public,Kimberly Guilfoyle,Campus Speech,Other,Student(s),From the Right,No,No,Substantial Event Disruption,No,"Turning Point USA hosted an event featuring Guilfoyle (and Donald Trump Jr.). During the event, supporters of Trump Jr.'s father, former President Trump, heckled Trump Jr. and disrupted the event after learning the Q&amp;A session had been canceled by Turning Point USA.",None,[],65c1510779db8200391e9a77
