2014,Saint John's University,Religious,Hugh Evans,Commencement Speech,Other,Activist(s),From the Right,No,No,Disinvitation Attempt,Not Applicable,The Cardinal Newman Society urged the university to rescind its invitation of Evans to deliver a commencement speech because of Evans' views on birth control.  Evans spoke successfully.,Supported Speaker (or Artist) as a Person. The university interim president called Evans a “role model.”,[],65c1510f79db8200391ea54e
2014,St. Mary's College of California,Religious,Leon Panetta,Commencement Speech,Abortion,Activist(s),From the Right,No,No,Disinvitation Attempt,Not Applicable,The Cardinal Newman Society urged the college to rescind its invitation of Panetta to deliver a commencement speech because of Panetta's views on abortion. Panetta spoke successfully.,Unknown,[],65c1510f79db8200391ea555
2014,Stanford University,Secular,Bloody Bloody Andrew Jackson,Performance,"Health, Race","Student Group(s), Student(s)",From the Left,No,No,Withdrew,No,"The co-chairs of the Stanford American Indian Organization met with the student director and student co-producers of the play, Bloody Bloody Andrew Jackson, to express concern over how the play represented Native Americans and issues such as depression, suicide, and alcoholism. After a month of meetings where student organizers considered altering the script and Native American activists threatened to protest, the director and co-producers decided not to perform the play and instead staged a musical cabaret titled, Did We Offend You?",None,[],65c1510f79db8200391ea55c
2014,Suffolk University,Secular,Abraham Foxman,Commencement Speech,"Foreign Affairs, Religion",Student(s),From the Left,No,Yes,Disinvitation Attempt,Not Applicable,Students protested the university's invitation of Foxman to deliver a commencement speech because of Foxman's statements about Muslims and his opposition to recognizing the Armenian Genocide. Foxman spoke successfully.,Supported Speaker (or Artist) as a Person. A spokesperson from the university president's office said: “Mr. Foxman’s body of work is well deserving of recognition. . . . It is our hope that Mr. Foxman’s personal story as a Holocaust survivor and attorney who has dedicated his life to public service will inspire our graduates as they embark on their professional careers.”,[],65c1510f79db8200391ea563
2014,"Tufts University, The Fletcher School of Law and Diplomacy",Secular,Eran Shamir-Borer,Campus Speech,Israeli-Palestinian Conflict,"Student Group(s), Student(s)",From the Left,No,Yes,Disinvitation Attempt,Not Applicable,"Students for Justice in Palestine petitioned the university to cancel an event featuring Shamir-Borer, the Israeli Defense Force's legal advisor during Operation Protective Edge, which resulted in the deaths of 2,127 Palestinians in Gaza. Shamir-Borer spoke successfully while students protested outside.",None,[],65c1510f79db8200391ea56a
2014,"University of California, Berkeley",Public,Peter Thiel,Campus Speech,"Civil Liberties, Police, Race","Activist(s), Student(s)",From the Left,No,No,Substantial Event Disruption,No,"The Berkeley Forum invited Thiel to discuss his views on political protest with students. Protesters broke into the venue and shouted Thiel down because ""Thiel’s Palantir [Technologies, a computer software company] is funded by CIA. Spies on people so they can rape forcefeed you through your ass,"" even though Thiel is opposed to intrusive government and supports policies that uphold civil liberties against the security policies of the federal government.","Honor Roll
Neutral. The president of the Berkeley Forum said: “We honestly didn't think the protests would interfere. . . .It’s pretty unimaginable and unfortunate. I'm in support of free speech, but this is not the right venue for that [kind of disruptive protest]. I'm very disappointed.”",[],65c1510f79db8200391ea571
