Year,School,School Type,Speaker/Performer/Title,Type of Expression,Controversy Topic(s),Source(s),Political Motives of Source(s),Petition For,Petition Against,Outcome,Reinvited/ Rescheduled/ Relocated?,Controversy Explanation,Public Response,Read More,fire_id
2019,Cornell University,Secular,Jannique Stewart,Campus Speech,"Abortion, Gender, Sexuality","Student Group(s), Student(s)",From the Left,No,No,Revoked,No,"The Cornell Political Union disinvited Stewart from a campus abortion debate, allegedly because of her traditional Christian views on marriage and sexuality. Organizers stressed that their decision had nothing to do with Stewart's views: Instead, they explained on their Facebook page: “As an undergraduate organization, we have limited funds, and paying for security would have put a great financial strain on the organization.”","Neutral (Disingenuous). The VP of university relations told reporters: “They [the student club] made this decision without engaging with the administration on event planning or security. The University in no way requested or suggested that any guest be excluded from attending this campus event, and to date we have made no recommendation related to potential university costs associated with supporting the event. . . . As we have frequently noted, free speech is an essential part of Cornell University’s commitment to the discovery of truth, and the University’s leadership is resolute in upholding the principle of freedom of expression on our campuses.""",[],65c1510679db8200391e9920
2019,Cornell University,Secular,The Vagina Monologues,Performance,Gender,Student Group(s),From the Left,No,No,Rejected,No,"A student group canceled an annual performance of the play, The Vagina Monologues, claiming it equates having a vagina with female identity and objecting to the play's author requiring that the monologues remain unchanged.",Unknown,[],65c1510679db8200391e9927
2019,Creighton University,Religious,Bob Kerrey,Commencement Speech,"Abortion, Political Views",Politician(s),From the Right,No,No,Withdrew,Yes,Kerrey withdrew as commencement speaker after the Nebraska Republican Party called on the university to disinvite Kerrey because of his support for abortion access. The university president said Kerry would speak at the Presidential Lecture Series later that year. Kerrey appeared at the lecture series and spoke successfully.,"Supported Speaker (or Artist) as a Person, Encouraged (or Approved of) Self-Censorship). The president of the university said: ""I appreciate his [Kerry's] desire not to have the focus of the day shifted away from our students."" But he also said Kerry would be invited to lecture later.",[],65c1510679db8200391e992e
2019,DePaul University,Religious,The Vagina Monologues,Performance,"Gender, Religion, Sexuality",Activist(s),From the Right,No,No,Cancellation Attempt,Not Applicable,"The Cardinal Newman Society opposed the performance of the play, The Vagina Monologues, and directly contacted the university to confirm that the performance was scheduled and ask that it be canceled. The event took place.",Unknown,[],65c1510679db8200391e9935
2019,Duke University,Secular,Tzipi Livni,Campus Speech,Israeli-Palestinian Conflict,Student(s),From the Left,No,No,Attempted Disruption,No,"During Livni's speech protestors began shouting the names of Palestinians that Israeli soldiers killed during the 2008-09 Gaza War and chanting, ""You can’t hide, we charge you with genocide,"" at Livni for his role in Israeli policy regarding Palestine. Security escorted protestors out of the room and Livni finished his remarks.",None,[],65c1510679db8200391e993c
2019,Fordham University,Religious,Sean Kingston,Performance,Criminal or Other Misconduct,"Administrator(s), Student Group(s), Student(s)",From the Left,No,Yes,Revoked,No,Multiple student petitions called on the university to cancel Kingston's performance because of a past sexual assault allegation against Kingston. The dean of students canceled Kingston's performance.,"Condemned Speaker (or Artist) as a Person, Appeased Protesters. The Dean of Students said: ""Now that these multiple perspectives have been heard, and we have had time to gather all available information—including additional concerns regarding Mr. Kingston’s appearance—I have decided to remove him from the Spring Weekend lineup. We are mindful that this is an extraordinary measure for the University to take, but also that the concerns raised are extraordinary and have been thoroughly discussed by the student organizations involved.""",[],65c1510679db8200391e9943
2019,Franciscan University of Steubenville,Religious,Blase Cupich,Campus Speech,"Abortion, Sexuality","Alumni, Stakeholder(s), Student(s)",From the Right,No,Yes,Disinvitation Attempt,Not Applicable,"Students, alumni, and university donors petitioned the university to disinvite Cupich from a campus religious conference over Cupich's views on abortion and homosexuality. Cupich spoke successfully.","Condemned Content of Expression, Appeased Protesters. The president of the university said:  ""I, along with so many, have been profoundly disappointed by the troubling revelations about some of our bishops. . . . Yet, bishops receive their authority from Christ and unless that authority is officially taken away from them, I don't believe the Lord wants me to decide whether or not we should welcome this or that bishop.""",[],65c1510779db8200391e994a
2019,Gallaudet University,Secular,Tom Cole,Commencement Speech,"Health, Political Views",Student(s),From the Left,No,Yes,Disinvitation Attempt,Not Applicable,"Students petitioned the university, a private federally chartered university for the deaf and hard of hearing, to consider a deaf person for commencement speaker instead of Cole, who protesters said ""has consistently voted against our values of diversity, inclusion, and equality."" Cole spoke successfully.",None,[],65c1510779db8200391e9951
2019,Georgetown University,Religious,Fabolous,Performance,Criminal or Other Misconduct,"Administrator(s), Student(s)",Not Applicable,No,Yes,Revoked,No,The university canceled a performance by the rapper Fabolous because Fabolous was convicted of a domestic violence charge.,"Condemned Speaker (or Artist) as Person, Appeased Protesters. The Director of Intercollegiate Athletics said: “After engaging with students, we have canceled the musical act for 2019 Hoya Madness. We take domestic violence very seriously and were unaware of the charges against the entertainer when he was booked through a third party entity.”",[],65c1510779db8200391e9958
2019,"Georgetown University, Georgetown Law",Religious,Kevin McAleenan,Campus Speech,Immigration,"Activist(s), General Public, Students",From the Left,No,Yes,Substantial Event Disruption,No,"Two separate petitions were circulated —&nbsp;one by outside organizations and one by students, alumni, and faculty — requesting that conference organizers rescind McAleenan’s invitation to speak because of his views on U.S. immigration policy. At the event, protestors repeatedly interrupted McAleenan, preventing him from starting his speech. Organizers tried to calm the crowd, but after making three failed attempts to begin his presentation, McAleenan thanked his hosts and left.",None,[],65c1510779db8200391e995f
2019,Georgia Southern University,Public,Jennine Capó Crucet,Campus Speech,"Class or Policy Issues, Race",Student(s),From the Right,No,No,Attempted Disruption,No,"After a hostile exchange between Crucet and a student during the Q&amp;A portion of Crucet's talk on the topic of white privilege, students in attendance started shouting, yelling, and chanting. Later in the evening, after the event had concluded, students burned copies of Crucet's book on campus and some gathered outside her hotel, leading Crucet to change hotels.","Honor Roll
Neutral. A spokesperson said: “While it’s within the students’ First Amendment rights, book burning does not align with Georgia Southern’s values nor does it encourage the civil discourse and debate of ideas.”

Honor Roll, High Honors
Neutral. A statement from the Department of History said: ""Book burning is at odds with our values of reasoned discourse, civil treatment of others, and openness towards ideas and experiences we might not share. Historically, book burning has been associated with intolerant and anti-democratic regimes. In the context of our diverse campus community, this symbolically potent action, combined with students’ online harassment of Professor Capó Crucet, who is Latina, reads as an act of intimidation. It represents a rejection of our core values, which include respect for others, reasoned intellectual inquiry, and an appreciation for our shared bonds. We condemn this behavior in the strongest of terms.""",[],65c1510779db8200391e9966
2019,Georgia Southern University,Public,Jennine Capó Crucet,Campus Speech,"Class or Policy Issues, Race","Administrator(s), Student(s)",From the Right,No,No,Revoked,No,"Crucet was scheduled to make a second appearance at a different GSU campus the day after students burned her books in protest, claiming Crucert was guilty of “racism towards white people.” After the book burning protest the second event was canceled.",Neutral (Disingenuous). Crucer posted on Twitter that the second appearance was canceled “because the administration said they could not guarantee my safety or the safety of its students on campus because of open carry laws.”,[],65c1510779db8200391e996d
2019,Georgia State University,Public,Abby Martin,Campus Speech,Israeli-Palestinian Conflict,Administrator(s),From the Right,No,No,Revoked,No,"Administrators required Martin to agree not to support a boycott of Israel as part of her honorarium contract, as required by Georgia law. When she refused, the university revoked the invitation. Martin filed a lawsuit and won.",None,[],65c1510779db8200391e9974
2019,Georgia Tech University,Public,Alveda King,Campus Speech,"Abortion, Sexuality, Civil Liberties","Student Group(s), Student(s)",From the Left,No,No,Revoked,No,"The student government denied funding to Students for Life for a speaking event featuring King over King's ""inherently religious"" views on abortion and gay marriage. Students for Life filed a lawsuit over the denial of funds. The university settled and changed the policy that allowed the student government to deny funding based on a speaker's viewpoint.",Neutral (Disingenuous). The administration stated: “Georgia Tech holds freedom of expression as an essential cornerstone to the advancement of knowledge.,[],65c1510779db8200391e997b
2019,Gonzaga University,Religious,The Vagina Monologues,Performance,"Gender, Religion, Sexuality",Activist(s),From the Right,No,No,Cancellation Attempt,Not Applicable,"The Cardinal Newman Society opposed the performance of the play, The Vagina Monologues, and directly contacted the university to confirm that the performance was scheduled and ask that it be canceled, but the university for the first time in its history allowed a public performance of the play.",Unknown,[],65c1510779db8200391e9982
2019,Grand Canyon University,Religious,Ben Shapiro,Campus Speech,Other,Administrator(s),From the Left,No,No,Revoked,Yes,"The university canceled Shapiro's speech in order to “focus on opportunities that bring people together.” After receiving criticism of its decision, the university reinvited Shapiro to speak and he spoke successfully.","Condemned Speaker (or Artist) as a person, Appeased Protesters. A university statement included: ""Our decision to cancel Shapiro's speaking engagement is not a reflection of his ideologies or the values he represents, but rather a desire to focus on opportunities that bring people together.""",[],65c1510779db8200391e9989
2019,"Harvard University, Harvard Law",Secular,Bruce Fein,Campus Speech,Foreign Affairs,"Student Group(s), Student(s)",From the Left,No,No,Revoked,No,"The Harvard Law School Forum, a student-run club, disinvited Fein because of Fein's views on the Armenian genocide, a topic on which he had not been asked to speak.",None,[],65c1510779db8200391e9990
2019,"Harvard University, The John F. Kennedy School of Government",Secular,Bridget Terry Long,Campus Speech,"Class or Policy Issues, Environment, Judiciary System","Student Group(s), Student(s)",From the Left,No,No,Substantial Event Disruption,No,Protesters occupied the stage and refused to leave during a speech by Long (and Lawrence S. Bacow). The protesters called for the university to divest from fossil fuels and prisons. The event was moved to another location and continued uninterrupted afterward.,"Honor Roll
Neutral. Dean of the Kennedy School told student protestors: “I understand that some of you want to make a point, and you can make that point, but I'm afraid [what] you can't do is to hinder the ability of other people here to listen to our speakers.""",[],65c1510779db8200391e9997
2019,"Harvard University, The John F. Kennedy School of Government",Secular,Lawrence S. Bacow,Campus Speech,"Class or Policy Issues, Environment, Judiciary System","Student Group(s), Student(s)",From the Left,No,No,Substantial Event Disruption,No,Protesters occupied the stage and refused to leave during a speech by Bacow (and Bridget Terry Long). The protesters called on the university to divest from fossil fuels and prisons. The event was moved to another location and continued uninterrupted afterward.,"Honor Roll
Neutral. Dean of the Kennedy School told student protestors: “I understand that some of you want to make a point, and you can make that point, but I'm afraid [what] you can't do is to hinder the ability of other people here to listen to our speakers.""",[],65c1510779db8200391e999e
2019,Holy Names University,Religious,The Vagina Monologues,Performance,"Gender, Religion, Sexuality",Activist(s),From the Right,No,No,Cancellation Attempt,Not Applicable,"The Cardinal Newman Society opposed the performance of the play, The Vagina Monologues, and directly contacted the university to confirm that the performance was scheduled and ask that it be canceled. The event took place.",Unknown,[],65c1510779db8200391e99a5
2019,John Carroll University,Religious,JCU's Annual Drag Show,Performance,Gender,Administrator(s),From the Right,Yes,No,Canceled,No,"The university canceled an annual student-organized drag show, claiming it might create ""divisiveness"" on campus.","Encouraged (or Approved of) Self-Censorship. The university president issued a statement that included: “In my judgment, the drag show is not the best way to proceed. Rather, we need more and better programming that promotes the awareness and understanding of all identities on campus, especially our LGBTQIA+ students, and creates broader engagement.”",[],65c1510779db8200391e99ac
2019,Loyola College,Religious,Amy Irvin,Campus Speech,Abortion,"Administrator(s), Student Group(s), Student(s)",From the Right,No,No,Revoked,No,University administrators pressured the College Democrats to disinvite Irvin from a student-run campus debate on abortion. Organizers reported that they were told by the administration that Irvin was too extreme and could potentially reflect badly on Loyola if outsiders were to believe Loyola had funded the event.,"Condemned Content of Expression, Appeased Protesters. The Executive Director of Student Affairs told the school paper: “As we got nearer to the event, I did a little more research on the backgrounds of the various speakers and I was concerned that inviting a representative from the New Orleans Abortion Fund, which raises money to pay for legal abortions, ran counter to our Jesuit, Catholic values and the university’s official pro-life stance.""",[],65c1510779db8200391e99b3
2019,Loyola Marymount University,Religious,Ben Shapiro,Campus Speech,Political Views,"Administrator(s), Faculty",From the Left,No,No,Disinvitation Attempt,Not Applicable,"A professor called on the university to cancel an event featuring Shapiro. Administrators initially required event organizers to answer ""reflective questions"" as a condition for approving the event but backed down after pushback. Shapiro spoke successfully.","Encouraged (or Approved of) Self-Censorship. The university released a statement that stated: ""While the university engages in student developmental exercises designed to encourage thoughtful dialogue and assist with event planning, the process does not predetermined decisions nor diminish our support for speakers across a broad range of personal and political views.""",[],65c1510779db8200391e99ba
2019,Loyola University of Maryland,Religious,The Vagina Monologues,Performance,"Gender, Religion, Sexuality",Activist(s),From the Right,No,No,Cancellation Attempt,Not Applicable,"The Cardinal Newman Society opposed the performance of the play, The Vagina Monologues, and directly contacted the university to confirm that the performance was scheduled and ask that it be canceled. The event took place.",Unknown,[],65c1510779db8200391e99c1
2019,Maryville University,Secular,J.C. Watts,Commencement Speech,"Civil Liberties, Gender, Sexuality",Student(s),From the Left,No,Yes,Disinvitation Attempt,Not Applicable,Students petitioned the university to disinvite Watts from delivering a commencement speech because of Watts' support for the Defense of Marriage Act. Watts spoke successfully.,None,[],65c1510779db8200391e99c8
2019,Massachusetts Institute of Technology,Public,Subramanian Swamy,Campus Speech,"Class or Policy Issues, Health, Religion, Sexuality","Activist(s), Faculty, Student(s)",From the Left,No,Yes,Disinvitation Attempt,Not Applicable,"Students, professors, and activist organizations petitioned the university to disinvite Swamy from the MIT India Conference because of Swamy's views on Muslims, homosexuality, and marginalized Indian communities. Swamy spoke successfully.",None,[],65c1510779db8200391e99cf
2019,Middlebury College,Secular,Ryszard Legutko,Campus Speech,"Gender, Immigration, Political Views, Race, Sexuality","Administrator(s), Faculty, Student(s)",From the Left,No,Yes,Revoked,Yes,"The college canceled a speech by Legutko, citing safety concerns, following student protests over Legutko's conservative political views. A Middlebury College professor invited Legutko to speak in his class instead.",Neutral (Disingenuous). College administrators released a statement that stated: “It [the event Cancellation] was based on an assessment of our ability to respond effectively to potential security and safety risks for both the lecture and the event students had planned in response.”,[],65c1510779db8200391e99d6
2019,Mount St. Mary's University,Religious,Mark K. Shriver,Commencement Speech,"Abortion, Health","Activist(s), Alumni, Student(s)",From the Right,No,Yes,Disinvitation Attempt,Not Applicable,"The Cardinal Newman Society urged the university to disinvite Shriver from delivering a commencement speech because of Shriver's pro-choice views and his advocacy for sex-education and family planning. Students and alumni also petitioned the university to rescind Shriver's invitation, accruing more than 22,000 signatures. Shriver spoke successfully.","Honor Roll, High Honors
Neutral. The university president said: ""To invite someone to speak at any event on campus is not an endorsement of every statement or action of that speaker. Instead, the invitation expresses our confidence in that person's ability to inspire or educate our students, in order to deepen their understanding of how they can live lives of significance in service to God and others.""",[],65c1510779db8200391e99dd
2019,New York University,Secular,Linda Sarsour,Campus Speech,"Israeli-Palestinian Conflict, Race","Activist(s), General Public",From the Right,No,Yes,Disinvitation Attempt,Not Applicable,"Radical Alert started a petition to disinvite Sarsour from participating in a campus event, objecting to Sarsour's views on the Israeli-Palestinian conflict. Sarsour spoke successfully.","Honor Roll
Neutral. A university spokesperson said that “it is the policy of the University to permit open dialogue and to support academic freedom.""",[],65c1510779db8200391e99e4
2019,Northeastern Illinois University,Public,Sean Spicer,Campus Speech,"Gender, Immigration, Political Views, Race","Alumni, Anonymous, Faculty, Student Group(s), Student(s)",From the Left,No,Yes,Disinvitation Attempt,Not Applicable,"Students, faculty, staff, and alumni petitioned the university to disinvite Spicer from a talk because of his role in the Trump administration. Spicer spoke successfully but during his presentation a protester rushed the stage and was arrested.","Appeased Protesters. A university spokesperson said that there were “a couple of minor disruptions . . . [but overall the event] did what it intended to do which was give debate to important topics of the day. . . . And we were able to have peaceful protests on campus, so people who choose to protest made their voices heard inside the auditorium and were heard by media coverage of the event. . . . We absolutely respect their right to do that.”",[],65c1510779db8200391e99eb
2019,Northwestern University,Secular,Jeff Sessions,Campus Speech,"Political Views, Race, Class or Policy Issues, immigration",Student(s),From the Left,No,No,Attempted Disruption,No,"Student protesters disrupted a speaking event featuring Sessions hosted by the College Republicans. Protesters climbed in windows and pushed past security, shouting about Sessions' immigration policies and calling him racist. Police eventually secured the event hall and Sessions finished his talk despite the disruptions.",None,[],65c1510779db8200391e99f2
2019,Ohio University,Public,Sean Kingston,Performance,Criminal or Other Misconduct,Student(s),From the Left,No,No,Cancellation Attempt,No,"Students called on the university to cancel Kingston's performance because a sexual assault allegation made against the singer in 2010. The student newspaper protested the administration's decision to allow Kingston to perform by publishing an editorial that urged the university to ""follow the lead of those other universities that have taken a stand and make it clear that they truly stand with survivors"" and refusing to cover the event. Kingston performed successfully.",None,[],65c1510779db8200391e99f9
2019,Portland State University,Public,Michael Strickland,Campus Speech,"Criminal or Other Misconduct, Political Views, Race",Student(s),From the Left,No,No,Attempted Disruption,No,"Police stood idly by while a student activist used a cowbell to disrupt a speaking event featuring Strickland. The student was acting in revenge for Strickland having pointed a gun at him two years ago during a BLM protest. The charges against Strickland are still in litigation and Strickland claims he pointed the gun in self-defense since he was surrounded by BLM protesters, some with sticks. It took about an hour for the bell-ringing student to leave, but once he did, Strickland's talk proceeded as planned.","Neutral (Disingenuous). A university statement read: “When an individual disrupted the event by ringing a cowbell, the officer used his professional judgment and determined not to threaten or restrain the individual so as not to escalate a potentially unsafe situation.”",[],65c1510779db8200391e9a00
2019,Princeton University,Secular,Amy Wax,Campus Speech,"Immigration, Race","Student Group(s), Student(s)",From the Left,No,No,Disinvitation Attempt,Not Applicable,"The American Whig-Cliosophic Society (Whig-Clio), who had rescinded Wax's invitation to speak on-campus a year earlier, reinvited Wax (and Keith Whittington) to appear at a campus free speech event. The student newspaper editorial board called on Whig-Clio to disinvite Wax from a campus talk due to Wax's views on immigration, race, and American culture. The club disavowed its support of Wax and said the decision to invite her was made by trustees of the society and against student recommendation. Wax (and Whittington) spoke successfully.",None,[],65c1510779db8200391e9a07
2019,Princeton University,Secular,Keith Whittington,Campus Speech,"Immigration, Race","Student Group(s), Student(s)",From the Left,No,No,Disinvitation Attempt,Not Applicable,"The American Whig-Cliosophic Society, which canceled an event featuring Whittington and Amy Wax a year prior because of Wax's views on immigration, race, and American culture, reinvited Whittington (and Wax) to appear at a campus free speech event. The student newspaper editorial board called on Whig-Clio to disinvite Wax again. The club disavowed its support of Wax and said the decision to invite her was made by trustees of the society and against student recommendation. Whittington (and Wax) spoke successfully.",None,[],65c1510779db8200391e9a0e
2019,Regis University,Religious,The Vagina Monologues,Performance,"Gender, Religion, Sexuality",Activist(s),From the Right,No,No,Cancellation Attempt,Not Applicable,"The Cardinal Newman Society opposed the performance of the play, The Vagina Monologues, and directly contacted the university to confirm that the performance was scheduled and ask that it be canceled. The event took place.",Unknown,[],65c1510779db8200391e9a15
2019,Rice University,Secular,Mike Pence,Campus Speech,"Foreign Affairs, Gender, Political Views, Sexuality","Alumni, Faculty, Student Group(s), Student(s)",From the Left,No,Yes,Disinvitation Attempt,Not Applicable,"Students petitioned the university to disinvite Pence from a campus talk about Venezuela, objecting to Pence's views on LGBT issues and his conservative beliefs. Pence spoke successfully while protests occurred on campus.",None,[],65c1510779db8200391e9a1c
